query_id,subject_id,subject_def,evalue,identity,midline,query_start,query_end
10_fwd,gi|91064875|ref|NM_153564.2|,"Mus musculus guanylate binding protein 5 (Gbp5), mRNA",16.2097,19 / 21,|||| ||||||||| ||||||,0,4
1_rev,gi|1447727817|ref|NM_008427.5|,"Mus musculus potassium inwardly-rectifying channel, subfamily J, member 4 (Kcnj4), mRNA",197.509,17 / 19,||||||||||| | |||||,0,11
1_rev,gi|1907110326|ref|XM_006520488.4|,"PREDICTED: Mus musculus potassium inwardly-rectifying channel, subfamily J, member 4 (Kcnj4), transcript variant X3, mRNA",197.509,17 / 19,||||||||||| | |||||,0,11
4_rev,gi|1907171074|ref|XM_036165880.1|,"PREDICTED: Mus musculus hexokinase 2 (Hk2), transcript variant X2, mRNA",197.492,18 / 21,|||||| |||  |||||||||,0,10
4_rev,gi|2275452373|ref|NM_013820.4|,"Mus musculus hexokinase 2 (Hk2), mRNA",197.492,18 / 21,|||||| |||  |||||||||,0,10
4_rev,gi|1907171072|ref|XM_017321401.3|,"PREDICTED: Mus musculus hexokinase 2 (Hk2), transcript variant X1, mRNA",197.492,18 / 21,|||||| |||  |||||||||,0,10
14_rev,gi|1907158118|ref|XR_881138.3|,"PREDICTED: Mus musculus predicted gene, 29883 (Gm29883), transcript variant X1, ncRNA",16.2097,19 / 21,||||||||  |||||||||||,1,9
